Sheet: Sheet1
B1: Expenses chart for the Paris stay:
B3: Expense: | C3: Kasper: | D3: Robert: | E3: Total:
B4: Taxi from the Airport | C4: 56 | E4: =SUM(RC[-2]:RC[-1]) -> 56
B5: Food in Leader Price | D5: 22.45 | E5: =SUM(RC[-2]:RC[-1]) -> 22.45
B6: Metro tickets | C6: 0.3 | D6: 2.1 | E6: =SUM(RC[-2]:RC[-1]) -> 2.4
B7: Entrance at Tour Eiffel | D7: =2*3.1 -> 6.2 | E7: =SUM(RC[-2]:RC[-1]) -> 6.2
B11: Total amounts | C11: =SUM(R[-7]C:R[-1]C) -> 56.3 | D11: =SUM(R[-7]C:R[-1]C) -> 30.75 | E11: =SUM(R[-7]C:R[-1]C) -> 87.050000000000011
B12: Difference | C12: =-R[-1]C+(R11C5/2) -> -12.774999999999991 | D12: =-R[-1]C+(R11C5/2) -> 12.775000000000006